{"schemaVersion":1,"meta":{"gameVersion":"1.4.0.525","plugins":["FalloutNV.esm","HonestHearts.esm"],"pluginsHash":"0123456789abcdef","timestamp":"2026-10-15T12:00:00Z","instance":"host","counts":{"quests":3,"globals":22,"reputations":2}},"shared":{"quests":{"FalloutNV.esm:104C00":{"edid":"TestQuest00","name":"Test Quest 0","rawFlags":0,"running":false,"completed":false,"failed":false,"currentStage":0,"completedStages":[],"objectives":{"10":{"displayed":false,"completed":false}},"vars":{"iCounter":0.0,"bDone":0}},"FalloutNV.esm:104C01":{"edid":"TestQuest01","name":"Test Quest 1","rawFlags":1,"running":true,"completed":false,"failed":false,"currentStage":10,"completedStages":[],"objectives":{"10":{"displayed":true,"completed":false}},"vars":{"iCounter":1.0,"bDone":0}},"FalloutNV.esm:104C02":{"edid":"TestQuest02","name":"Test Quest 2","rawFlags":1,"running":true,"completed":false,"failed":false,"currentStage":20,"completedStages":[10],"objectives":{"10":{"displayed":true,"completed":true}},"vars":{"iCounter":2.0,"bDone":0}}},"globals":{"FalloutNV.esm:0A0000":{"edid":"TestGlobal00","type":"s","value":0.0},"FalloutNV.esm:0A0001":{"edid":"TestGlobal01","type":"f","value":1.0},"FalloutNV.esm:0A0002":{"edid":"TestGlobal02","type":"s","value":2.0},"FalloutNV.esm:0A0003":{"edid":"TestGlobal03","type":"f","value":3.0},"FalloutNV.esm:0A0004":{"edid":"TestGlobal04","type":"s","value":4.0},"FalloutNV.esm:0A0005":{"edid":"TestGlobal05","type":"f","value":5.0},"FalloutNV.esm:0A0006":{"edid":"TestGlobal06","type":"s","value":6.0},"FalloutNV.esm:0A0007":{"edid":"TestGlobal07","type":"f","value":7.0},"FalloutNV.esm:0A0008":{"edid":"TestGlobal08","type":"s","value":8.0},"FalloutNV.esm:0A0009":{"edid":"TestGlobal09","type":"f","value":9.0},"FalloutNV.esm:0A000A":{"edid":"TestGlobal10","type":"s","value":10.0},"FalloutNV.esm:0A000B":{"edid":"TestGlobal11","type":"f","value":11.0},"FalloutNV.esm:0A000C":{"edid":"TestGlobal12","type":"s","value":12.0},"FalloutNV.esm:0A000D":{"edid":"TestGlobal13","type":"f","value":13.0},"FalloutNV.esm:0A000E":{"edid":"TestGlobal14","type":"s","value":14.0},"FalloutNV.esm:0A000F":{"edid":"TestGlobal15","type":"f","value":15.0},"FalloutNV.esm:0A0010":{"edid":"TestGlobal16","type":"s","value":16.0},"FalloutNV.esm:0A0011":{"edid":"TestGlobal17","type":"f","value":17.0},"FalloutNV.esm:0A0012":{"edid":"TestGlobal18","type":"s","value":18.0},"FalloutNV.esm:0A0013":{"edid":"TestGlobal19","type":"f","value":19.0},"FalloutNV.esm:000038":{"edid":"GameHour","type":"f","value":9.5},"FalloutNV.esm:000039":{"edid":"GameDaysPassed","type":"f","value":1.25}},"reputations":{"FalloutNV.esm:0F7F85":{"edid":"NCR","fame":12.0,"infamy":0.0},"FalloutNV.esm:0F7F86":{"edid":"Legion","fame":0.0,"infamy":3.5}},"karma":25.0,"factionRanks":{"FalloutNV.esm:0E5B3C":{"edid":"GoodspringsFaction","rank":1}},"refs":{"FalloutNV.esm:104C8F":{"exists":true,"edid":"DocMitchell","alive":true,"enabled":true,"cell":"FalloutNV.esm:0DA3F6"},"FalloutNV.esm:104C90":{"exists":true,"edid":"Sunny","alive":true,"enabled":true,"cell":"FalloutNV.esm:0DA3F6"}}},"perPlayer":{"host":{"actorValues":{"Karma":{"base":25.0,"current":25.0},"Speech":{"base":30.0,"current":30.0}},"inventory":{"FalloutNV.esm:0DE1AA":{"edid":"QuestItemA","count":1}},"caps":120,"perks":{"FalloutNV.esm:0C0001":1},"position":{"x":1000.5,"y":-200.25,"z":64.0,"rotZ":1.5,"cell":"FalloutNV.esm:0DA3F6"}}}}
